{
  "schema_version": "bar-observatory-interpretation-1.0",
  "interpretation": {
    "id": "barobs-int-20260730-example-001",
    "report_id": "barobs-20260730-example-001",
    "report_hash": "sha256:example-report-json",
    "generated_at": "2026-07-30T12:34:00-04:00",
    "provider": "claude-code-session",
    "model": "runtime-recorded-example",
    "prompt_version": "bar-self-improvement-v1",
    "example": true,
    "status": "interpreted",
    "disclaimer": "LLM-generated interpretation. Deterministic facts remain in the separate engineering report."
  },
  "executive_synthesis": {
    "headline": "The system recovered, but the replay task exposed a specification and routing gap.",
    "summary": "Rework was concentrated rather than systemic. The largest hotspot combined an unstated migration invariant, reactive skill use, and a late validator handoff. Human input was most valuable at the architecture boundary; routine performance recovery occurred without human intervention.",
    "fact_refs": [
      "task.replay-ordering",
      "rework.replay-ordering",
      "recovery.summary",
      "observation.MO-001"
    ]
  },
  "findings": [
    {
      "finding_id": "F-001",
      "category": "rework",
      "title": "Replay ordering was the dominant improvement target",
      "statement": "Four loops and two agents concentrated on one task, while most phases and tasks completed with little or no rework.",
      "kind": "fact_summary",
      "confidence": "high",
      "fact_refs": [
        "task.replay-ordering",
        "rework.replay-ordering",
        "phase.integration"
      ],
      "evidence_refs": [
        "validation-03",
        "validation-04",
        "validation-05",
        "validation-07"
      ],
      "counter_evidence": [],
      "uncertainty": "Task complexity is not normalized, so this is a hotspot finding rather than an agent-efficiency judgment.",
      "recommended_action": "Make the migration-ordering invariant explicit before implementation and require a replay fixture in the task acceptance criteria.",
      "verification_plan": "Compare loops and validation attempts on the next replay task using the new fixture."
    },
    {
      "finding_id": "F-002",
      "category": "routing",
      "title": "Validator involvement arrived after repeated integration failure",
      "statement": "The handoff to Validator 02 occurred only in the fourth loop. Earlier validator review may reduce repeated migration-ordering failures.",
      "kind": "inference",
      "confidence": "medium",
      "fact_refs": [
        "rework.rw-03",
        "agent.agent-validator-02",
        "task.replay-ordering"
      ],
      "evidence_refs": [
        "handoff-12",
        "validation-06",
        "validation-07"
      ],
      "counter_evidence": [
        "Earlier validator involvement could add overhead on routine tasks."
      ],
      "uncertainty": "The report does not contain a controlled comparison with early validator routing.",
      "recommended_action": "Route a validator at plan approval for tasks touching replay ordering or migrations.",
      "verification_plan": "Run the next two qualifying tasks with early validator review and compare rework events without using a quality score."
    },
    {
      "finding_id": "F-003",
      "category": "human_ai",
      "title": "Human judgment was valuable at the invariant boundary, not routine recovery",
      "statement": "The replay task needed one human clarification about the migration invariant, while the stop-hook performance task recovered through agent work and validation without a human event.",
      "kind": "fact_summary",
      "confidence": "high",
      "fact_refs": [
        "recovery.replay-03",
        "recovery.hook-02"
      ],
      "evidence_refs": [
        "prompt-77",
        "validation-07",
        "benchmark-14",
        "benchmark-18"
      ],
      "counter_evidence": [],
      "uncertainty": "Only captured human events are classified; off-channel intervention would be unknown.",
      "recommended_action": "Reserve human escalation for invariant, acceptance, permission, and architectural decisions; keep routine debug recovery agent-led.",
      "verification_plan": "Track classification and unknown capture rate across the next ten recovery intervals."
    },
    {
      "finding_id": "F-004",
      "category": "skills",
      "title": "Rust debugging was used reactively after failures",
      "statement": "The rust-debugging skill was invoked after replay failures rather than preloaded for the task. This suggests a routing or task-template opportunity.",
      "kind": "inference",
      "confidence": "medium",
      "fact_refs": [
        "skill.rust-debugging",
        "task.replay-ordering"
      ],
      "evidence_refs": [
        "skill-event-31",
        "skill-event-34",
        "validation-03"
      ],
      "counter_evidence": [
        "Preloading more skills may increase context and token use."
      ],
      "uncertainty": "Skill invocation is correlated with the task; the report cannot prove that preloading would prevent failure.",
      "recommended_action": "Add a replay-task profile that preloads migration and debugging guidance only when task scope matches.",
      "verification_plan": "A/B the profile on comparable replay fixtures and inspect loops, tokens, and validation outcomes."
    },
    {
      "finding_id": "F-005",
      "category": "silent_signal",
      "title": "Final handoff understated the recovery path",
      "statement": "Three recorded replay validation failures were absent from the final handoff. The system should require material failure and recovery disclosure at task completion.",
      "kind": "fact_summary",
      "confidence": "high",
      "fact_refs": [
        "observation.SS-001"
      ],
      "evidence_refs": [
        "validation-03",
        "validation-04",
        "validation-05",
        "handoff-replay-final"
      ],
      "counter_evidence": [],
      "uncertainty": "The handoff may have been intentionally concise, but the omitted failures were material to future maintenance.",
      "recommended_action": "Add an automated completion note section listing failed validations, human interventions, superseded outputs, and unresolved risks.",
      "verification_plan": "Completion gate rejects a handoff when material evidence categories are omitted."
    },
    {
      "finding_id": "F-006",
      "category": "micro_observation",
      "title": "The migration assumption should become a system asset",
      "statement": "The agent's explicit monotonic-migration assumption is reusable knowledge and should be promoted into the replay specification, a failing fixture, and the migration skill.",
      "kind": "recommendation",
      "confidence": "high",
      "fact_refs": [
        "observation.MO-001"
      ],
      "evidence_refs": [
        "message-agent-replay-18"
      ],
      "counter_evidence": [],
      "uncertainty": "The exact invariant should be confirmed against current migration semantics before promotion.",
      "recommended_action": "Promote one observation into three synchronized assets: specification rule, regression test, and skill update.",
      "verification_plan": "The next replay task must cite the rule and pass the new fixture before completion."
    }
  ],
  "experiments": [
    {
      "experiment_id": "EXP-001",
      "priority": 1,
      "title": "Replay ordering contract",
      "red": "Add a fixture that replays non-monotonic migration metadata and fails under the current ordering assumption.",
      "green": "Implement an explicit replay ordering contract and validator that passes the fixture.",
      "optimize": "Preload the migration skill and route a validator at plan approval only for matching tasks.",
      "success_measures": [
        "fewer replay rework events",
        "no regression in final validation",
        "bounded token increase"
      ],
      "fact_refs": [
        "task.replay-ordering",
        "observation.MO-001"
      ]
    },
    {
      "experiment_id": "EXP-002",
      "priority": 2,
      "title": "Evidence-complete handoff",
      "red": "Create a golden handoff that fails when material validation failures or human interventions are omitted.",
      "green": "Generate an evidence-backed completion summary from task facts.",
      "optimize": "Keep the summary concise while preserving links to full evidence.",
      "success_measures": [
        "zero completion_without_evidence signals",
        "material failures disclosed",
        "no manual duplication"
      ],
      "fact_refs": [
        "observation.SS-001",
        "observation.SS-002"
      ]
    },
    {
      "experiment_id": "EXP-003",
      "priority": 3,
      "title": "Selective skill preload",
      "red": "Record the current reactive skill-use baseline on a replay fixture.",
      "green": "Add a task-profile rule that preloads migration/debugging skills for matching scope.",
      "optimize": "Remove unnecessary preload when the task classifier confidence is low.",
      "success_measures": [
        "skill available before first failure",
        "no material context inflation",
        "equal or lower rework"
      ],
      "fact_refs": [
        "skill.rust-debugging",
        "skill.sqlite-migrations"
      ]
    }
  ],
  "promotion_candidates": [
    {
      "observation_id": "MO-001",
      "targets": [
        "specification",
        "regression_test",
        "skill_update"
      ],
      "human_approval_required": true
    },
    {
      "observation_id": "SS-001",
      "targets": [
        "completion_gate",
        "task_template"
      ],
      "human_approval_required": true
    }
  ]
}
